{
 "cutoff": 2020,
 "levels": 2,
 "budgets": [
  3,
  5
 ],
 "supernodes": [
  {
   "id": "S_models",
   "level": 0,
   "parent_id": null,
   "member_ids": [
    "m1",
    "m2"
   ],
   "label": "models",
   "gloss": "Fixture super-node grouping m1, m2."
  },
  {
   "id": "S_eval",
   "level": 0,
   "parent_id": null,
   "member_ids": [
    "t1",
    "d1"
   ],
   "label": "eval",
   "gloss": "Fixture super-node grouping t1, d1."
  },
  {
   "id": "S_gnn",
   "level": 1,
   "parent_id": "S_models",
   "member_ids": [
    "m1",
    "m2"
   ],
   "label": "gnn",
   "gloss": "Fixture super-node grouping m1, m2."
  },
  {
   "id": "S_tasks",
   "level": 1,
   "parent_id": "S_eval",
   "member_ids": [
    "t1"
   ],
   "label": "tasks",
   "gloss": "Fixture super-node grouping t1."
  },
  {
   "id": "S_data",
   "level": 1,
   "parent_id": "S_eval",
   "member_ids": [
    "d1"
   ],
   "label": "data",
   "gloss": "Fixture super-node grouping d1."
  },
  {
   "id": "S_deep",
   "level": 2,
   "parent_id": "S_gnn",
   "member_ids": [
    "m1"
   ],
   "label": "deep",
   "gloss": "Fixture super-node grouping m1."
  }
 ]
}
