{
 "cutoff": 2022,
 "levels": 2,
 "budgets": [
  3,
  5
 ],
 "supernodes": [
  {
   "id": "S_models",
   "level": 0,
   "parent_id": null,
   "member_ids": [
    "m1",
    "m2",
    "m3"
   ],
   "label": "models",
   "gloss": "Fixture super-node grouping m1, m2, m3."
  },
  {
   "id": "S_eval",
   "level": 0,
   "parent_id": null,
   "member_ids": [
    "t1",
    "d1",
    "t2",
    "d2"
   ],
   "label": "eval",
   "gloss": "Fixture super-node grouping t1, d1, t2, d2."
  },
  {
   "id": "S_gnn",
   "level": 1,
   "parent_id": "S_models",
   "member_ids": [
    "m1",
    "m3"
   ],
   "label": "gnn",
   "gloss": "Fixture super-node grouping m1, m3."
  },
  {
   "id": "S_kernel",
   "level": 1,
   "parent_id": "S_models",
   "member_ids": [
    "m2"
   ],
   "label": "kernel",
   "gloss": "Fixture super-node grouping m2."
  },
  {
   "id": "S_tasks",
   "level": 1,
   "parent_id": "S_eval",
   "member_ids": [
    "t1"
   ],
   "label": "tasks",
   "gloss": "Fixture super-node grouping t1, t2."
  },
  {
   "id": "S_data",
   "level": 1,
   "parent_id": "S_eval",
   "member_ids": [
    "d1"
   ],
   "label": "data",
   "gloss": "Fixture super-node grouping d1."
  },
  {
   "id": "S_new",
   "level": 1,
   "parent_id": "S_eval",
   "member_ids": [
    "d2"
   ],
   "label": "new",
   "gloss": "Fixture super-node grouping d2."
  }
 ]
}
