{
 "cutoff": 2020,
 "levels": 1,
 "budgets": [
  3,
  5
 ],
 "supernodes": [
  {
   "id": "S_models",
   "level": 0,
   "parent_id": null,
   "member_ids": [
    "m1",
    "m2"
   ],
   "label": "models",
   "gloss": "Fixture super-node grouping m1, m2."
  },
  {
   "id": "S_eval",
   "level": 0,
   "parent_id": null,
   "member_ids": [
    "t1",
    "d1"
   ],
   "label": "eval",
   "gloss": "Fixture super-node grouping t1, d1."
  }
 ]
}
